document,chunk,text,question
"looking-at-music,-an-experiment-with-kotlin,-javafx,-midi,-and-virtual-threads",0,"When a nerdy dad and music-playing son join forces and start experimenting with music and code, some nice things can happen. Did you ever present your music piece in a business dashboard with charts? Did you know that the FXGL game library can be used to generate a piano with fireworks? Let's look at music with the MelodyMatrix application (https://melodymatrix.rocks/) and guide you through the process of how a small experiment turned into a full-blown project. This talk is not just about code but also features a live piano performance by a 14-year-old musician-coder. Let's have a battle between humans and machines! Who is the best piano player? The musician or a few thousand Virtual Threads? And how far can we push the app's performance to send ByteArrays to an LED strip to react to the music?   Topics in this talk: Java, Kotlin, JavaFX, Gradle, FXGL, MIDI, Vaadin, GitHub Actions, JDeploy",How does the MelodyMatrix application integrate music performance with technology like LED strips and virtual threads?
datafaker:-the-most-powerful-fake-data-generator-library,1,"data) providers- sequences (collections and stream)- date formats- expressions- transformations- unique valuesIn the end, patterns for generating better data like the Test Data Factory will also take place to add more control to the data generation.",What is a method for improving data generation to add more control?
empowering-diversity-and-inclusion-at-remote-workplaces,0,"Everyone has been having conversations about how diversity is crucial and an asset. But do we really understand it? Are we really embracing a diverse and inclusive workplace?Could we all together handle the stress from COVID-19 and the extended isolation because of remote workplace driving negative emotions in employees together as a firm? How can a diverse and inclusive workplace boost business performance consistently ? The remote workplace has changed team dynamics. Some employees are more productive while some are not, they need in person interaction. In this lecture, we will talk about how we can build a diverse and inclusive environment while working remotely to foster an open culture and everyone can adapt and innovate with flexibility. We will learn from Yahoo’s steps in building a diverse community that is empowering and a safe space for all Yahoo employees to voice their feelings, ask questions, share any concerns they have or just listen. When we listen and celebrate what is both common and different, we become a wiser, more inclusive, and better organization.",How can a diverse and inclusive remote workplace improve business performance?
we-need-you---accessibility-on-web,0,"Could you imagine going to the hospital in a wheelchair and not being able to get inside due to the 20 steps of stairs you have to take without the option of a ramp? In the Netherlands, public buildings have to be accessible, but what about web?  The reality is that using the internet is becoming more and more unavoidable, but accessibility is often an afterthought.  In this talk, I would like to show you what impact you can make. Discover a wide scope of disabilities you might not even have thought about when working on your application and which tools are available to help you and your users.",What tools can help improve accessibility for users with disabilities when working on web applications?
the-ai-elections:-how-technology-could-shape-public-sentiment,1," world where technology shapes narratives, understanding its potential and pitfalls is crucial. This talk aims to spark discourse and promote a future where technology serves societal betterment, not manipulation.",How can technology be used to benefit society rather than manipulate it?
model-mitosis:-stop-making-the-wrong-choice-between-microservices-and-monolith,1, monolith.,What is a monolith and what are some examples of it throughout history?
cracking-the-code:-ai-hallucinations-and-live-hacking,0,"Is your organization ready to transform your coding practices with generative AI tools such as Copilot, ChatGPT, or Code Whisperer? Do you know how to use these tools to boost your development speed without sacrificing security? Join this session to explore the potential and pitfalls of generative AI in coding.In this interactive session, we will discuss the risks associated with generative AI, including hallucinations and security vulnerabilities. We’ll demonstrate live coding of an application using Copilot and ChatGPT, followed by a live hacking session to expose the weaknesses in the generated code. Watch as we uncover issues like SQL injections, cross-site scripting, and directory traversal in real-time. Join us to discover how to balance speed and security in your projects and learn how to safely use GenAI's power to enhance your coding efficiency while minimizing risks.",What are some potential security risks associated with using generative AI tools for coding?
"looking-at-music,-an-experiment-with-kotlin,-javafx,-midi,-and-virtual-threads",1,",…",What is missing from the context provided?
that’s-a-wrap:-learn-storytelling-from-storytellers,0,"Mirror, mirror on the wall, why doesn’t my PO believe me at all? If you can relate to this question, I have the solution for you: storytelling. By using proven techniques to convey your story, you will soon be able to convince your PO about your marvelous ideas.  If this is not for you, you should think again because every person can learn to tell a story. Even better, you probably already know what is essential to tell a great story; you need to connect the dots in your mind. Let me help you connect those dots so that the next time, you can ask your mirror how you should name your variables.",How can storytelling help in convincing a project officer about your ideas?
coding-a-disability-inclusive-world:-3-stories,0,"Imagine you have a brother called John. He has a light form of Down Syndrome. He used to go to the bar with his friends, got some financial resources from his grandpa. Had loads of fun! Today, the world is only accessible via a digital interface. Unfortunately John is not able to use a computer with the software currently build, not able to use a smartphone with apps either. With a bitter feeling John's parents decide to put him in a home for people with disabilities. John is not able to participate in the digital world. He is not able to participate in the world at all.Lisa is a teenager on the autism spectrum. She is not the smartest of the class but she's not dumb either. She need some more time to execute the thoughts in her head. She has a brother without autism or other disabilities. Unfortunately Lisa's parents focus all the way on her brother. In school, due to time restrictions teachers only invest the bare minimum in Lisa. It seems more",What challenges does Lisa face in her educational environment and family life?
datafaker:-the-most-powerful-fake-data-generator-library,0,"Data generators in software testing play a critical role in creating realistic and diverse datasets for testing scenarios. However, they present challenges, such as ensuring data diversity, maintaining quality, facilitating validation, and ensuring long-term maintainability.While many engineers are familiar with these challenges, they often resort to non-specialized tools like the RandomStringUtils class from Apache Commons or the Random class, concatenating fixed data with it. This approach lacks scalability and may not yield a valid dataset.Thankfully we have DataFaker, a library for Java and Kotlin to generate fake data, based on generators, that can be very helpful when generating test data to fill a database, to generate data for a stress test, or to anonymize data from production services.With practical examples, you will learn how to generate data based on:- different or multiple locales- random enum values- different generators like address, code (books), currency, date and time, finance, internet, measurement, money, name, time, and others- custom (",What are some of the limitations engineers face when using non-specialized tools for data generation in software testing?
model-mitosis:-stop-making-the-wrong-choice-between-microservices-and-monolith,0,"Just as development should be iterative, software design should change when the context and our understanding of the problem evolve. As a software grows to solve more problems, it becomes less supple in its ability to evolve. Tensions arise within the business model of the software that struggles to stay coherent.Eventually it reaches a critical mass and becomes a monolith of spaghetti code. How do we know when it’s time to modularize our software? How do we carry on the decision to split it into several modules or services? How can we handle the progressive differenciation of our business models while avoiding unnecessary coupling? It’s not as easy as a clean axe cut in the middle, finding the right boundaries can be tricky.We would like to introduce the Model Mitosis, a dynamic approach used to split a business model into multiple ones that will get shaped and decoupled iteratively. Gain flexibility to choose better when to split into multiple services, and avoid paying the scale cost of microservices or becoming a distributed",What challenges arise when deciding to split a software into multiple modules or services?
build-the-best-knowledge-retriever-for-your-large-language-model.,0,"Generative AI is here to stay. Tools to generate text, images, or data are now common goods. Large Language models (LLMs) only have the knowledge they acquired through learning, and even that knowledge does not include all the details. To overcome the knowledge problem, the Retrieval Augmented Generation (RAG) pattern arose. An essential part of RAG is the retrieval part. Retrieval is not new. The search or retrieval domain is rich with tools, metrics and research. The new kid on the block is semantic search using vectors. Vector search got a jump start with the rise of LLMs and RAG.This workshop aims to build a high-quality retriever, integrate the retriever into your LLM solution and measure the overall quality of your RAG system.The workshop uses our Rag4j/Rag4p framework, which we created especially for workshops. It is easy to learn, so you can focus on understanding and building the details of the components during the workshop.",What is the purpose of using the Retrieval Augmented Generation (RAG) pattern in relation to large language models?
"let’s-use-intellij-as-a-game-engine,-just-because-we-can",1," all, the most important work we do is often the work we find the most fun. Come ready to chuckle, learn, and maybe even be inspired to try your own offbeat experiments!",What kind of work might be considered both important and fun according to the context?
are-functional-tests-the-way-to-go?,1," would like to prevent the wild growth that is present in the current tests, both in number of step definitions, as in ways to write the steps.In this talk we would like to show you how that attempt went. What issues we countered, how we solved them, and what architecture and framework we used. A lessons learned, so far.",What challenges were faced and how were they addressed in managing the growth of step definitions and writing methods?
know-your-java,0,"Really? You may wonder. This is 2024 and do we all not know Java already really well. Most of us do and yet there are so many things we tend to not realize until those things bite us in the back. This is not an introductory session on Java but one in which we will take existing code, discuss its behavior, look into surprises it holds. These are scenarios that either the speaker has stubbed his toes on or things he has been other developers stub their toes, from practical every day realistic code.",Why do developers often encounter unexpected issues in Java despite being familiar with the language?
confessions-of-a-shortcut-a-holic,0,"Consider the following dilemma. Would you rather that A - the buttons on your mouse are completely disabled, or B - every time you press a button on your keyboard, the result is not what it says on the label?When I started to have serious RSI issues in my arms 5 years ago, I knew I had to make some tough choices and change things up drastically. I started experimenting with my set-up, by trying things such as the options of the aforementioned dilemma. These set-up changes have helped me reduce straining my hands. Since then, I've tried all kinds of keyboards, layouts and shortcut optimizations, and I think it's fair to say that I'm addicted!Throughout my various adventures, I've assembled a list of do's and don'ts that I think can benefit anyone, whether you're typing with 2 fingers, or you can type over 100 words per minute blindfolded. In this talk, I will confess all about my addiction, and rank my",What kind of changes did the person make to reduce strain on their hands due to RSI issues?
pwning-your-java-service,0,"We've been developing Java services for years, but how can we ensure they're truly secure? Instead of approaching security from a builders perspective, this talk will tackle it from a breakers mindset.In this talk, we'll dive into hacking Java-based web applications. focusing on practical, real-world examples. Through code snippets and hands-on demonstrations, you'll learn step-by-step how attackers exploit vulnerabilities in Java-based web applications - and more importantly, how to defend against them. Let's explore the hackers toolkit and uncover hidden weaknesses in your Java services.",How can developers protect their Java-based web applications from hackers exploiting vulnerabilities?
"exploring-the-jvm-landscape:-java,-kotlin,-and-scala",0,"In this talk, we'll dive into the dynamic landscape of JVM languages, focusing on Java, Kotlin, and Scala. Drawing from years of experience with these languages, we'll discuss the strengths and weaknesses of each, how they've evolved over time, and how they tackle various programming challenges. Whether you're a seasoned Java developer or curious about other JVM languages, this session will provide a comprehensive comparison, showcasing different approaches to common problems and sharing insights from the broader development community. Join us for an objective and informative discussion on the state of Java, Kotlin, and Scala.","What are some of the advantages and disadvantages of using JVM languages like Java, Kotlin, and Scala?"
generative-ai-on-millions-of-lines-of-code;-a-recipe-for-success?,0,"Generative AI can be a powerful force multiplier for developers, but it also comes with limitations. Developers are expected to co-create with AI, and check the generated output, or risk hallucinations running wild. This can aid development at a local machine, but what happens when you try to apply these tools on a massive scale?At Moderne we've explored Generative AI for our users, as stewards for OpenRewrite and the Moderne Platform, to automate code changes as scale. In this talk we'll take you through our lessons learned as we tried our hand at AI, to tell you what worked, and what failed, such that you can learn from our experiences. It will be an honest look back, and brief look ahead on our process, to show you how our customers can now reliably leverage AI for code modernization.",What are some challenges developers face when using generative AI on a large scale for code modernization?
10-top-owasp-projects-beyond-the-owasp-top-10,0,"In Software development, security is no longer optional. Log4Shell, Spring4Shell, Apache Struts and various CVE's in Jenkins, XZUtils and other tools taught us it’s a necessity. While the OWASP Top 10 is widely known as the list of common security risks, there’s a wealth of other OWASP projects that can help Java developers build more secure applications. This talk, ""10 Top OWASP Projects Beyond the OWASP Top 10,"" aims to shine a spotlight on ten essential OWASP initiatives that go beyond the basics, offering tools, frameworks, and best practices tailored specifically for the modern software developer.Attendees will leave with actionable insights on how to leverage these projects to enhance their security posture, integrate robust security tools and practices into their software development lifecycle, and stay ahead of emerging threats. This session will ensure that both novice and experienced developers walk away with valuable knowledge that they can apply immediately.",What additional resources does the talk suggest Java developers can use to improve application security beyond the commonly known list of risks?
tulips-to-turmeric:-lessons-learned-from-a-global-team,1, possibilities.,What might happen in different situations depending on various potential outcomes?
how-to-get-your-team-to-care-about-code-quality,0,"In a perfect world everyone would care about code quality… But you know, deadlines happen, maybe you have a colleague who just can’t bother, or a product owner who doesn’t understand why it is important. Sara will share a variation of tools (such as SonarQube, Azure DevOps, and Mend Bolt) which lets you measure and control the quality and maintainability of your code, and how you can use them to make code quality a goal for the whole team (even non-developers!). Being aware of your code and actively working to improve it makes it easier to maintain and keeps the team sharp, and even more importantly, having everyone on board makes it a priority (instead of that story which never makes it into the sprint…).",What are some tools that can be used to measure and control code quality and maintainability?
what-bitcoin-and-minimalism-can-teach-you-about-clean-coding,0,"Minimalism is a lifestyle which focuses on simplicity and having purpose. More and more people are minimizing distractions, setting priorities and choosing quality over quantity every day. Focusing on the essential is something which can also be said about Bitcoin. This ""currency of the future"" can be viewed from many different angles. One is the economic angle, in which owners are holding on to their coins like their life depends on it. Another is the technical angle, which is complex and innovative, but slow and stable as well. In this talk we'll explore some of the principles from both bitcoin and minimalism, and see how they can be applied to coding.",How can principles from minimalism and Bitcoin be applied to the practice of coding?
spring-modulith:-slicing-onions-without-crying,0,"The architecture of an application fundamentally determines its maintainability, scalability, and overall quality. Spring, renowned for its versatility, empowers developers to align technical components with domain concepts, for more coherent and maintainable codebases. This session explores how Spring Modulith amplifies these principles, offering developers a framework for crafting modular and maintainable Spring Boot applications. You will learn how to cleanly cut your architecture, validate the package structure with automated tests, and generate diagrams to create overview. We'll also showcase how Picnic benefits from using Spring Modulith!",How does Spring Modulith enhance developers' ability to create modular and maintainable applications?
coding-a-disability-inclusive-world:-3-stories,2,'s possible to build the digital world in a way that everyone can participate. I'll show you how!,How can the digital world be built to enable everyone's participation?
braving-the-change:-recalibrating-to-new-realities,0,"‘Change is the only constant in our industry’… but they never told us it would go this fast. With the recent evolutions in AI, ‘change’ has shifted from a ‘constant’ to something better described as ’exponential,’ sparking excitement for some and existential dread for others.In this session, we’ll discuss some insights into dealing with change gathered from experts in the field. We’ll explore the emotional aspects of change, contextualize our relation to change and discuss skills and strategies to deal with evolving landscapes.After leaving this session, you’ll be better prepared for whatever change might come on your path. And with preparation comes bravery.",What can be learned in this session to help people cope with rapid changes in the industry?
"end-to-end-ml-with-kubernetes,-ray-and-java",1," to MLEstablishing a Ray cluster within KubernetesExecuting distributed ML training jobsModel serving on KubernetesIntegrating model endpoints in Java applications using LangChain4jWe will cover the entire lifecycle of a containerized, Java-based LLM application, from data preparation to training or fine-tuning foundational models. The session will also explore options for model deployment and integration with Java applications using vector databases for Retrieval-Augmented Generation (RAG), all orchestrated on Kubernetes.This comprehensive overview caters to Java developers, data scientists, MLOps engineers, and DevOps professionals, offering valuable insights across the ML application spectrum.",What are some of the key steps involved in deploying and integrating machine learning models in Java applications using vector databases on Kubernetes?
"java-23---better-language,-better-apis,-better-runtime",0,"Java 21 was an explosive release, but 22 and 23 are no slouches either:* from unnamed patterns to module imports* from the foreign-function and memory API to stream gatherers and the class-file API* from a simpler `main` to launching multi-source-file programs* from Markdown in JavaDoc to improved garbage collectionThere are plenty of features in the language, API, and runtime to discuss - whether new, improved, or finalized. So let's go over them!",What are some of the notable features introduced or improved in recent Java releases?
be-an-effective-polyglot-developer:-learn-languages-like-it's-nobody's-business!,0,"In the fast-paced world of software development, mastering multiple programming languages is no longer just a luxury—it's a game-changer. With AI tools transforming our industry, the ability to switch between languages effortlessly is more crucial than ever. Having conquered languages like Java, Go, TypeScript, and Rust, and comfortably coding in a dozen more, I've learned valuable lessons on this journey that I'm excited to share.Join me for an exhilarating session where I'll reveal the secrets to becoming an effective polyglot developer. Discover practical strategies to rapidly and effectively learn new languages, and understand how adopting a polyglot mindset can turbocharge your problem-solving skills and skyrocket your career.Highlights of the session include:- The Polyglot Mindset: Uncover the perks of being a polyglot developer and how it can open doors to innovative solutions and new opportunities.- Learning Hacks: Dive into techniques for mastering and keeping up with new programming languages with speed and confidence.Whether you're a seasoned developer looking",Why is being proficient in multiple programming languages considered a game-changer in software development today?
building-a-bullshit-language,0,"I have created AnnotationScript, a programming language whose syntax is expressed entirely in Java annotations. Yes, you read that right: Java annotations.WTF!?The pandemic lockdowns of 2020 did strange things to people. Some people started learning the guitar. Others decided to get in shape. But not me. I decided to take Java annotations to their logical extreme.I think annotations are over-used in the Java ecosystem: you can use them for dependency injection, handling HTTP requests, and interacting with databases. You can even use them to generate code in various ways. But for some reason, nobody has actually used them to implement a full-blown, Turing-complete programming language like LISP. Until now.Do you want to know how easy it is to actually implement LISP? Do you want to know how easy it is to recursively implement LISP in the LISP you just implemented? Do you want to know about the weird restrictions that Java annotations have?You will be amazed. Weirded-out and amazed",What is the unique concept behind AnnotationScript as a programming language?
bootiful-spring-boot:-a-dogumentary,0,"Spring Boot 3.x and Java 21 have arrived, making it an exciting time to be a Java developer! Join me, Josh Long (@starbuxman), as we dive into the future of Spring Boot with Java 21. Discover how to scale your applications and codebases effortlessly. We'll explore the robust Spring Boot ecosystem, featuring AI, modularity, seamless data access, and cutting-edge production optimizations like Project Loom's virtual threads, GraalVM, AppCDS, and more. Let's explore the latest-and-greatest in Spring Boot to build faster, more scalable, more efficient, more modular, more secure, and more intelligent systems and services.",What new features and optimizations does the latest version of Spring Boot offer for building scalable and efficient applications?
