document,chunk,text,question
the-ai-elections:-how-technology-could-shape-public-sentiment,0,"In the age of Deepfakes and Large Language Models (LLMs), the threat of misusing AI for shaping and manipulating public sentiment has reached unprecedented levels. In this talk, we shed light on the capabilities of Artificial Intelligence (AI), and its potential implications for our societies.As pivotal elections in both the UK and USA loom in 2024, it is important to understand the evolving landscape of political influence, particularly in the digital realm. Remembering the impact of Cambridge Analytica’s manipulation during the Brexit era serves as a reminder of how information can be distorted to sway public opinion. In this keynote, we show the capabilities of modern AI and how they can be misused for shaping public opinion, using examples like Realtime Deepfakes and LLM-powered chatbots. Through a series of live demonstrations and showcases, we unveil the inner workings and technical foundation of these neural networks, highlight their capabilities and their weaknesses, and give an outlook on how we as a society can resist manipulation.In a",How can modern AI tools like Deepfakes and chatbots be misused to influence public opinion during elections?
nljug-modern-it-leadership-summit-2024,1," the intricacies of measuring productivity of software engineering teams. Our panelists will explore the challenges of traditional metrics, the role of modern software engineering intelligence tools, output-based contracting and the cultural impact of measurement practices on teams.With this event, panelists can offer the J-Fall audience insights into the challenges they face and establish closer connections with the Dutch Java community.MILS primarily targets IT management, IT leaders, CTOs, and CIOs. However, all J-Fall attendees are welcome to join this session.",What are the potential challenges associated with traditional methods used to assess productivity in software engineering teams?
help!-i-hate-my-teammate!,0,"Everybody now and then comes into a new team, or someone else comes into theirs. More often than not, cooperation does not go seamlessly straight away. Sometimes this evens out by itself along the way. But in many occasions, it does not. Ways of working could be different. Something one values a lot, may not be valued at all by another, creating conflict. One may criticise or get criticised and things get uncomfortable. Teams may split into ""camps"" or one person just never agrees with the others. Team members may feel stepped over, pushed aside or misunderstood. If this goes on for too long, team members start to feel generally disrespected and demotivated. Then there are cases one member feels another is not qualified, or just a bully. This goes beyond forming and storming, this becomes a (team-wide) problem. In this session you will see you are not the only one experiencing these challenges. You will hear experiences on solving these kind of cases",What are some challenges team members might face when integrating into a new team?
public-static-void-main-🎶,0,"Why just type the words “public static void main”, when you can also sing them? This talk-slash-pop-quiz is about 15 songs that will work with “public static void main” as the lyrics, enabling you to fully enjoy writing main methods while impressing your colleagues with your musical creativity at the same time.","What is the main idea behind using songs with ""public static void main"" as lyrics?"
java's-concurrency-journey-continues!-exploring-structured-concurrency-and-scoped-values,0,"Java's concurrency journey has been a long and winding one. We departed from the 'classic threads' station and traveled through Runnables, ExecutorServices, CompletableFutures and ForkJoinPools, before finally arriving at 'virtual threads'. But does 'finally' mean that we've arrived at our final destination, or is it a transfer at best?Now that virtual threads are available, our Java programs will likely use an abundance of threads. This increase in thread count will immediately make thread coordination, observability and isolation more difficult. Two new Java features are currently in development that might make things a bit easier: Structured Concurrency and Scoped Values.In this talk, we'll introduce and demonstrate these new features, and how they can help address the challenges that have emerged since the introduction of virtual threads. We'll also discuss how the availability of these features will impact your day-to-day programming life and whether Java's concurrency journey is actually over now that these features have become available or if there are",What are the challenges posed by the increase in thread count with the introduction of virtual threads in Java?
optimizing-santa's-travels-with-timefold,0,"Every Christmas Eve, Santa faces a monumental challenge: delivering gifts to millions of children around the world in just one night. There’s no time for detours, and a well-crafted plan is essential!In this talk, we’ll help Santa find the optimal travel route for his journey using Timefold, an open-source AI solver. By setting up some basic domain classes, you'll be able to tackle vehicle routing problems without getting lost in the magic (aka math).Through a series of live demos, you'll see practical examples in action and leave with a powerful new tool in your problem-solving toolbox. So join in and let's use our favorite programming language to make sure everyone gets their presents under the Christmas tree!",How can Timefold assist in optimizing Santa's delivery route on Christmas Eve?
from-data-to-information:-my-insightful-journey,0,"By definition, data and information are distinct concepts. While we are generating vast amounts of data – predictions suggest that we will reach 175 zettabytes by 2025, with approximately 2.5 exabytes generated daily – only a small portion of this massive volume is truly valuable. Even more noteworthy is the information that cannot be found as raw data but can be derived from the combinations of existing data.In this talk, I will share my journey from first hearing about Neo4j at a conference to utilizing this powerful tool for extracting valuable insights from student data. Perspectives that were once hidden to the naked eye became clearly evident when analyzing larger datasets and using data visualization techniques.I am Elvira van der Ven, a lecturer at the Rotterdam University of Applied Sciences and a student counselor for the Computer Science program.","What is the difference between data and information, and why is only a small portion of data considered truly valuable?"
java-in-the-green-cloud:-eco-friendly-development-with-kubernetes,0,"Dive into the fun side of sustainable software with 'Java in the Green Cloud.' and discover how to craft eco-friendly Java applications optimized for Kubernetes ecosystems. We'll explore whimsical yet practical tips on resource management, efficient algorithms, and leveraging cloud-native tools to minimize your environmental footprint. Perfect for developers of all levels, this session promises lively examples, interactive discussions, and green-themed coding challenges. Join us for a tech adventure that’s both fun and planet-friendly, all while mastering cloud-native Java development",What is the focus of the 'Java in the Green Cloud' session?
"the-power-of-open-source,-how-pet-projects-help-your-daily-work",0,In this presentation we explore why you should contribute to Open-Source Software and the benefits you can gain from it.,What are some advantages of contributing to open-source software?
inside-out-java:-exploring-data-structures-with-jol-visualization,0,"Discover the intricacies of Java with the latest update to the OpenJDK/JOL tool, now featuring an object graph visualizer. As one of the key contributors to this enhancement, I'll demonstrate how we can now visually explore the internal workings of Java data structures—from Strings and HashMaps to Streams and Threads. This session will use JOL to trace the evolution of these structures from Java 6 to the modern Java 22, providing valuable insights into their internal mechanics. This deeper understanding can lead to more efficient and effective use of the Java standard library. Whether you're a seasoned Java developer or looking to expand your knowledge of Java internals, this talk promises to be both educational and practically useful.",What new feature does the latest update to the OpenJDK/JOL tool offer for exploring Java data structures?
tdd-&-generative-ai---a-perfect-pairing?,0,"In this talk we will dive into the question whether generative AI can generate working code when we only provide test cases. So we take the main principle from TDD: we write the tests up front. Then we use a generative AI to create the code. If you wrote the tests correctly and they all pass, you should have a working prototype. Even better, if the tests pass and you trust the tests, the code is production ready!With some live coding, we will explore this idea together. Furthermore we will take a look at the implications of this paradigm shift. After attending you should be able to apply this technique to your own project.",What is the process of using generative AI to create code based on predefined test cases?
getting-unstuck-in-levelling-up---patterns-for-personal-development,0,"As a software engineer, you commit to a lifetime of learning. The IT world evolves so fast, and there is much unknown in the young field of software engineering.How can you keep learning and growing? You might feel overwhelmed by all the available information around you. Or maybe you think you know it all? Or do you feel like an imposter at work, because there is so much you still don't know? These thoughts are not helpful if you want to continue learning and leveling up. It would help if you saw how far you have come in your learning journey and what steps you still need to take.In this talk, I will show different ways of looking at your level of seniority and how those different views can be helpful. I'll also share some important values and principles for continuous learning. Additionally, I will discuss some behavioral patterns that you can use to level up your skills. I'll touch upon themes like the Growth Mindset, Learning from peers, Unlearning old views, Creating a",How can software engineers continuously improve and advance their skills in a rapidly evolving industry?
debugging-the-mind:-sharpen-your-problem-solving-skills,0,"Whether you're building the next big feature, optimizing performance, or squashing that stubborn bug, problem solving is at the heart of our profession. But coding is just one part of the equation—navigating challenges within your team and project is equally crucial. So when was the last time you consciously applied problem-solving techniques? Do you ever find your mind needs debugging in order to be effective? It’s time to sharpen your problem-solving skills and take them to the next level.On top of some ground work regarding frameworks and theories Marianne will help you uncover your own strengths and weaknesses. She’ll dive into common traps that developers face and explore practical strategies for deploying your problem-solving skills effectively. Whether you’re a seasoned pro or newer to Java, this session will provide valuable insights and actionable techniques that you can bring back to your codebase and your team.",What is emphasized as equally important to coding in a developer's work according to the text?
the-pitfalls-of-starting-a-big-project-without-the-right-experience,0,"So, a bit more than a year ago I came in to a new team that just started on a new big project. Using technologies that where new to them and me. So I did a course on the framework Spring Boot to get an understanding and it thought us to use technical packaging. This is fine for a small service, but after a year of new features. It became a mess. How can we fix it?In this talk I’ll share my experience on what went wrong, what we did to fix it and steps to prevent it.","What issues arose from using technical packaging in the project, and how were they resolved?"
the-era-of-aap:-ai-augmented-programming-using-only-java,0,"As we enter the era of AI-Augmented Programming (AAP), developers stand at the threshold of a profound shift in software creation and maintenance. This talk delves into the emerging paradigm where Java and Large Language Models (LLMs) are leveraged to enhance and automate various stages of the development lifecycle.We'll explore how Java and LLMs are reshaping Integrated Development Environments (IDEs) and transforming developer workflows. The presentation will demo the integration of both local and remote LLMs, demonstrating their practical applications in coding assistance, debugging, and even generating entire projects from high-level prompts.",How are Java and large language models changing the way developers use integrated development environments?
your-developer’s-intelligence-isn’t-artificial,1," culture, retention, wage policies, coaching and growth. I’ll warn you in advance: none of this is going to be easy. But at the other end of it lies a future where HR has become ‘human relations’ instead of the other meaning it usually carries. And that is worth fighting for…",What is the ultimate goal of transforming HR as mentioned in the context?
from-0-to-h-ai-ro:-unlock-the-power-of-generative-ai-with-langchain4j-and-spring-ai,0,"The JVM, especially Java, remains one of the most widely used platforms in enterprises today. But is it fit to leverage the enormous potential (generative) AI offers, with Python being the dominating language in this space? Join me for an insightful talk where we explore the leading JVM frameworks for AI: Spring AI and LangChain4j. These powerful tools enable millions of Java, Kotlin, Scala, and Groovy developers to tap into the transformative capabilities of generative AI.Discover how Spring AI and LangChain4j:- Effortlessly interact with LLMs across text, audio, images, and video.- Leverage semantic search using embeddings and vector databases.- Utilize retrieval-augmented generation (RAG) solutions and AI agents to amplify your LLM's potential with your own data and APIs.- Differ from each other and where their strengths and weaknesses lie.While building a real-world working generative AI application on the fly, all the mind-boggling concepts will be explained clearly and",What are the leading frameworks for AI on the JVM platform that allow developers to use generative AI capabilities?
"coupling,-cohesion,-and-the-blueprint-of-modern-software-design",0,"Coupling and cohesion are more than just technical terms in software architecture; they are the underlying forces that determine the success or failure of systems and organizations. But what exactly drives these principles? When does coupling turn problematic, and how can it be effectively managed?In this talk, I delve into the fundamental principles behind coupling and cohesion, using the conceptual dimensions of strength, distance, alignment, connectivity and rate of change. We'll explore how these dimensions can be classified and examine their impact on both coupling and cohesion, demonstrating how these concepts underpin many of today’s best practices in software design.By the end of this talk, you’ll uncover the power of the Formula of Pain—that reveal the inner workings of coupling and cohesion. These insights will deepen your understanding of the foundational principles behind design decisions, which can be applied across nearly every aspect of our work.",What are the conceptual dimensions that influence coupling and cohesion in software architecture?
help!-i-hate-my-teammate!,1," (or not!), get an idea of how others deal with it and what your options are if you ever find yourself in the weeds (again). In any case, you probably will be surprised by yourself or your team mate in one way or another...",What might you learn about handling unexpected situations from observing how others manage them?
confessions-of-a-shortcut-a-holic,1, experiments from absolutely essential to absurdly eccentric.,What range of experiments is discussed?
coding-a-disability-inclusive-world:-3-stories,1," interesting to invest in the other students. Lisa has more and more hassle to keep up with the rest of the class. When she is 18 she is not able to find a job. She is not able to participate in the world.Kim is 56 and has an accident with a severe brain injury. She has a lot of trouble to communicate and to understand what is happening around her. She is married with Dave, he is 66 and has a light form of dementia. The couple has a lot of difficulties navigating and living in the world where everything in real life has mandatory digital twin to access. They are not able to participate in the world.Today I'll teach you about those three persona's. 3 Persona's we unfortunately don't see enough in our day-to-day jobs and environment. I tell you, it's not because you don't see someone, they are not there! I have more than 10 years experience building digital interface for people with those kind of disabilities. It",What challenges do individuals with cognitive disabilities face when trying to navigate a highly digital world?
modernising-j-unit-with-test-data-generators,1," advanced topics like generating valid data based on JSR-380 bean validation, conditional data and benefits of property-based testing. Finally, be it simple and real looking fake data or complex object structures, be it randomness or repetition, for each situation I will explain which library to choose.",What are some of the benefits of using property-based testing in generating valid data structures?
architecting-for-tomorrow:-a-pragmatic-perspective,0,"In this session, I explore the transformation to becoming a more effective architect through pragmatism. Drawing inspiration from ""The Pragmatic Programmer"" book, I discuss the core principles of pragmatic architecture, striking a balance between complexity and simplicity. I emphasize adaptive decision-making with ""Just-in-time"" and ""Just-enough-architecture"" while promoting a culture of learning through the ""Fail-fast"" approach.I encourage architects to think big and start small, fostering adaptability with the Elsa Mindset. The Asoh Defense principle underscores the importance of taking responsibility for mistakes. Throughout, we stress the significance of effective communication in successful architectural endeavors. In conclusion, embracing pragmatism equips architects with valuable tools to make informed decisions, adapt to change, and efficiently deliver value to clients.",What core principles of pragmatic architecture are highlighted in the discussion on becoming a more effective architect?
"let’s-use-intellij-as-a-game-engine,-just-because-we-can",0,"Ever wondered what would happen if you used IntelliJ IDEA as a game engine? Probably not, but Alexander did, and it turns out, it’s absurd and a lot of fun! Join Alexander for a lighthearted yet insightful dive into the absurdness of using one of the most sophisticated IDEs to create games within your codebase because... well, why not?In this talk, Alexander will walk you through his adventure of using the IntelliJ plugin platform to implement game logic, render graphics, and more. He’ll share the head-scratching moments, the ""aha!"" breakthroughs, and the plain stupidity of making this idea work. You'll see IntelliJ handling sprites, game physics, and maybe even a rogue mutable variable trying to destroy your cursor!This session is for anyone who believes that the best projects are born from a spark of curiosity and a sense of fun. Discover how pushing the boundaries of your tools can lead to unexpected innovations and a lot of laughs along the way. After",What unique experience did Alexander create by using IntelliJ IDEA for game development?
migrating-spring-boot-apps-to-graalvm,0,"Spring Boot in Native Images are all the rage now: faster startup, stable performance and optimized resource usage, what's not to like? While it is super easy to integrate in a brand new, greenfield application, there are a few things you need to know to migrate older, already existing apps.While the Spring Ahead-Of-Time compilation process can infer a lot about an application, it is not enough. There are general patterns to follow, and common pitfalls that can be avoided.In this live demo, you will learn practical recipes for migrating an existing JVM-based Spring Boot application to Native Image, tips for improving your workflows, and how to measure the improvements Spring Native brings.",What are some considerations and tips for migrating an existing Spring Boot application to a native image?
code-coverage-mythbusters,0,"Code coverage is a compelling set of metrics that can help you improve the quality of your software, prevent potential bugs, and even help you investigate the issues.And as we know with great power comes great responsibility. When applied in the wrong way code coverage can easily transform from your best friend that can boost a developer’s productivity into your worst enemy that throws the sand in the wheels of your developers' productivity machine.After many years of answering community questions about code coverage in the JaCoCo mailing list, StackOverflow, and in the Sonar community forum we learned that most software engineers don’t understand the purpose of code coverage and how to apply it correctly. In this talk, we will dispel the most popular myths built around code coverage. This talk will help you understand the concept of code coverage, how it should be used, and how to boost your productivity with code coverage.",What is the purpose of code coverage and how can it be correctly applied to improve software quality?
a-brief-history-of-bugs,0,"After writing code that caused production issues I considered myself the worst developer in the world. But, historically, it seems I am not the only one that ever achieved that. In this talk I will go over a few small historical bugs with huge consequences.This talk refreshes your awareness of the importance of good coding standards. You probably still feel bad the next time you introduce a production issue. However, you might feel less lonely, since you’re not the only worst developer in the world.",Why might a developer feel less alone after attending this talk about historical coding mistakes?
clarifying-complexity:-boosting-developer-efficiency,0,"Down the rabbit hole - we've all been there. It's a classic consequence of misinterpreting complexity. From seemingly straightforward tasks to incomprehensible system failures - your ability to navigate varying levels of complexity is crucial for success. In this fast-paced Ignite session, I'll show how the Cynefin Framework can help you make sense of chaos. When developing software, complexity isn't just about the code. It involves context, resource availability, and interdependencies that can either speed up or slow down delivery.Learn how to avoid the rabbit hole by accurately assessing the complexity of your work and applying strategies that enhance your effectiveness.",What framework can be used to better understand and manage complex situations during software development?
are-functional-tests-the-way-to-go?,0,"At Nedap Healthcare we have some gracefully aged software. And because we often try to adopt new ideas, that code base has gone through many of the ideas of the last 25 years, including the hype where tests written in Cucumber ""would allow everyone to write tests"" (and of course spare us developers the task of having to do that ourselves).As with many hypes, that did not turn out quite as expected. Which resulted in a big set of UI tests that actually are quite fragile, will all kinds of tight coupling to the screens. Hindsight is always 20/20.So we recently revamped our UI tests and took a completely different approach: can we write test that have no coupling to the screens at all? Who describe the test in a functional or declarative style? That seems like a fairly trivial idea, but we had some worries like will those tests be fine grained enough? And cover all the scenario's that need to be tested? And of course we very much",What challenges did Nedap Healthcare face when attempting to revamp their UI tests?
the-state-of-server-side-java-webapps,0,"So, your application needs a web interface. Looking at today's trends, you might think JavaScript frameworks are reigning: React, Vue, Angular and many more. On the language axis, JavaScript got company from TypeScript, Web Assembly and even C#.But it's not all single-page applications that glitter! Of course, a single-page app delivers highly dynamic and interactive user interfaces, but at what expense? What if we revisited some of the ages past, when the server generated our web pages? Can we satisfy the ever-changing requirements of today's users for more interaction and dynamic behaviours using these patterns?Join me on a trip down memory lane so that we can appreciate server-side web applications again. We'll investigate today's options for keeping things simple. Of course, we'll see the contestants in action. This doesn't have to be boring, after all...",Why might someone consider using server-side applications instead of modern JavaScript frameworks for web interfaces?
